.icu-versions.json

{
  "latest": "79.1rc",
  "versions": [
    {
      "version": "79.1rc",
      "url": "https://github.com/unicode-org/icu/releases/download/release-79.1rc",
      "icu4c_ubuntu_x64_tgz": "icu4c-79.1rc-Ubuntu24.04-x64.tgz",
      "strip-components": 1,
      "icu4c_win64_zip": "icu4c-79.1rc-Win64-MSVC2026"
    },
    {
      "version": "78.3",
      "url": "https://github.com/unicode-org/icu/releases/download/release-78.3",
      "icu4c_ubuntu_x64_tgz": "icu4c-78.3-Ubuntu22.04-x64.tgz",
      "strip-components": 1,
      "icu4c_win64_zip": "icu4c-78.3-Win64-MSVC2022.zip"
    },
    {
      "version": "78.2",
      "url": "https://github.com/unicode-org/icu/releases/download/release-78.2",
      "icu4c_ubuntu_x64_tgz": "icu4c-78.2-Ubuntu22.04-x64.tgz",
      "strip-components": 1,
      "icu4c_win64_zip": "icu4c-78.2-Win64-MSVC2022.zip"
    },
    {
      "version": "78.1",
      "url": "https://github.com/unicode-org/icu/releases/download/release-78.1",
      "icu4c_ubuntu_x64_tgz": "icu4c-78.1-Ubuntu22.04-x64.tgz",
      "strip-components": 1,
      "icu4c_win64_zip": "icu4c-78.1-Win64-MSVC2022.zip"
    },
    {
      "version": "78.1rc",
      "url": "https://github.com/unicode-org/icu/releases/download/release-78.1rc",
      "icu4c_ubuntu_x64_tgz": "icu4c-78.1rc-Ubuntu22.04-x64.tgz",
      "strip-components": 1,
      "icu4c_win64_zip": "icu4c-78.1rc-Win64-MSVC2022.zip"
    },
    {
      "version": "77.1",
      "url": "https://github.com/unicode-org/icu/releases/download/release-77-1",
      "icu4c_ubuntu_x64_tgz": "icu4c-77_1-Ubuntu22.04-x64.tgz",
      "strip-components": 1,
      "icu4c_win64_zip": "icu4c-77_1-Win64-MSVC2022.zip"
    },
    {
      "version": "77.1rc",
      "url": "https://github.com/unicode-org/icu/releases/download/release-77-rc",
      "icu4c_ubuntu_x64_tgz": "icu4c-77_1rc-Ubuntu22.04-x64.tgz",
      "strip-components": 1,
      "icu4c_win64_zip": "icu4c-77_1rc-Win64-MSVC2022.zip"
    },
    {
      "version": "76.1",
      "url": "https://github.com/unicode-org/icu/releases/download/release-76-1",
      "icu4c_ubuntu_x64_tgz": "icu4c-76_1-Ubuntu22.04-x64.tgz",
      "strip-components": 1,
      "icu4c_win64_zip": "icu4c-76_1-Win64-MSVC2022.zip"
    },
    {
      "version": "76.1rc",
      "url": "https://github.com/unicode-org/icu/releases/download/release-76-rc",
      "icu4c_ubuntu_x64_tgz": "icu4c-76_1rc-Ubuntu22.04-x64.tgz",
      "strip-components": 1,
      "icu4c_win64_zip": "icu4c-76_1rc-Win64-MSVC2022.zip"
    },
    {
      "version": "75.1",
      "url": "https://github.com/unicode-org/icu/releases/download/release-75-1",
      "icu4c_ubuntu_x64_tgz": "icu4c-75_1-Ubuntu22.04-x64.tgz",
      "icu4c_win64_zip": "icu4c-75_1-Win64-MSVC2022.zip"
    },
    {
      "version": "75rc",
      "url": "https://github.com/unicode-org/icu/releases/download/release-75-rc",
      "icu4c_ubuntu_x64_tgz": "icu4c-75rc-Ubuntu-22.04.x64.tgz",
      "icu4c_win64_zip": "icu4c-75rc-Win64-MSVC2022.zip"
    },
    {
      "version": "74.2",
      "url": "https://github.com/unicode-org/icu/releases/download/release-74-2",
      "icu4c_ubuntu_x64_tgz": "icu4c-74_2-Ubuntu22.04-x64.tgz",
      "icu4c_win64_zip": "icu4c-74_2-Win64-MSVC2019.zip"
    },
    {
      "version": "74.1",
      "url": "https://github.com/unicode-org/icu/releases/download/release-74-1",
      "icu4c_ubuntu_x64_tgz": "icu4c-74_1-Ubuntu22.04-x64.tgz",
      "icu4c_win64_zip": "icu4c-74_1-Win64-MSVC2022.zip"
    },
    {
      "version": "74rc",
      "url": "https://github.com/unicode-org/icu/releases/download/release-74-rc",
      "icu4c_ubuntu_x64_tgz": "icu4c-74rc-Ubuntu-22.04.x64.tgz",
      "icu4c_win64_zip": "icu4c-74rc-Win64-MSVC2019.zip"
    },
    {
      "version": "73.2",
      "url": "https://github.com/unicode-org/icu/releases/download/release-73-2",
      "icu4c_ubuntu_x64_tgz": "icu4c-73_2-Ubuntu22.04-x64.tgz",
      "icu4c_win64_zip": "icu4c-73_2-Win64-MSVC2019.zip",
      "double_zipped_filename": "20230608.2_ICU4C_MSVC_x64_Release/icu-windows.zip"
    },
    {
      "version": "73.1",
      "url": "https://github.com/unicode-org/icu/releases/download/release-73-1",
      "icu4c_ubuntu_x64_tgz": "icu4c-73_1-Ubuntu22.04-x64.tgz",
      "icu4c_win64_zip": "icu4c-73_1-Win64-MSVC2019.zip"
    },
    {
      "version": "73rc",
      "url": "https://github.com/unicode-org/icu/releases/download/release-73-rc",
      "icu4c_ubuntu_x64_tgz": "icu4c-73rc-Ubuntu-22.04.x64.tgz",
      "icu4c_win64_zip": "icu4c-73rc-Win64-MSVC2019.zip",
      "double_zipped_filename": "20230323.12_ICU4C_MSVC_x64_Release/icu-windows.zip"
    },
    {
      "version": "72.1",
      "url": "https://github.com/unicode-org/icu/releases/download/release-72-1",
      "icu4c_ubuntu_x64_tgz": "icu4c-72_1-Ubuntu22.04-x64.tgz",
      "icu4c_win64_zip": "icu4c-72_1-Win64-MSVC2019.zip",
      "double_zipped_filename": "20221013.8_ICU4C_MSVC_x64_Release/icu-windows.zip"
    },
    {
      "version": "72rc",
      "url": "https://github.com/unicode-org/icu/releases/download/release-72-rc",
      "icu4c_ubuntu_x64_tgz": "icu4c-72rc-Ubuntu-22.04.x64.tgz",
      "icu4c_win64_zip": "icu4c-72rc-Win64-MSVC2019.zip",
      "double_zipped_filename": "20220922.23_ICU4C_MSVC_x64_Release/icu-windows.zip"
    },
    {
      "version": "71.1",
      "url": "https://github.com/unicode-org/icu/releases/download/release-71-1",
      "icu4c_ubuntu_x64_tgz": "icu4c-71_1-Ubuntu20.04-x64.tgz",
      "icu4c_win64_zip": "icu4c-71_1-Win64-MSVC2019.zip"
    },
    {
      "version": "70.1",
      "url": "https://github.com/unicode-org/icu/releases/download/release-70-1",
      "icu4c_ubuntu_x64_tgz": "icu4c-70_1-Ubuntu-20.04-x64.tgz",
      "icu4c_win64_zip": "icu4c-70_1-Win64-MSVC2019.zip"
    }
  ]
}

CHANGELOG.md

### Added

- Add support for Python 3.12
- Add support for [ICU 74.1] (partial) (#53)
- Add `icupy.icu.number.SimpleNumberFormatter` class (#55)

- Add support for Python 3.11
- Add support for [ICU 72.1] (9223a00, 8872898, 4da30bb, 65866ab, 3faffa3, 254f291, 4a00a15)

- Add support for [ICU 71.1] (e968747)
- Add `icupy.icu.u_string_has_binary_property()` (fe37f49)
- Add `icupy.icu.RuleBasedCollator.__init__(bin: collections.abc.Buffer, length: int, base: RuleBasedCollator)` (f3decea)

## 0.1.0 - 2021-01-30

[ICU 71.1]: https://github.com/unicode-org/icu/releases/tag/release-71-1
[ICU 72.1]: https://github.com/unicode-org/icu/releases/tag/release-72-1
[ICU 73.1]: https://github.com/unicode-org/icu/releases/tag/release-73-1
[ICU 73.2]: https://github.com/unicode-org/icu/releases/tag/release-73-2
[ICU 74.1]: https://github.com/unicode-org/icu/releases/tag/release-74-1
[ICU 74.2]: https://github.com/unicode-org/icu/releases/tag/release-74-2
[ICU 75.1]: https://github.com/unicode-org/icu/releases/tag/release-75-1
[ICU 76.1]: https://github.com/unicode-org/icu/releases/tag/release-76-1
[ICU 77.1]: https://github.com/unicode-org/icu/releases/tag/release-77-1
[ICU 78.1]: https://github.com/unicode-org/icu/releases/tag/release-78.1
[ICU 78.3]: https://github.com/unicode-org/icu/releases/tag/release-78.3